Question,A,B,C,D,source_folder
"Tổng số nhà máy thủy điện (bao gồm cả công suất lớn, vừa và nhỏ) đang hoạt động tại vùng Trung du miền núi phía Bắc là bao nhiêu?",41,158,168,330,public_test_fix
Kể tên ba loại bộ truyền ma sát phổ biến và công dụng chính của chúng?,"Bánh ma sát trụ, bánh ma sát côn, bộ truyền đai dẹt – dùng để truyền công suất giữa các trục","Bánh ma sát côn, bộ truyền xích, tay quay – dùng để tạo dao động","Bánh ma sát trụ, thanh răng, vít truyền – dùng để biến đổi năng lượng nhiệt","Bộ truyền đai dẹt, ổ chặn, nối bản lề – dùng để giảm tải trọng",public_test_fix
"Trong các loại nối trục, nối nào cho phép hấp thụ dao động và giảm chấn động?",Nối cứng,Nối cứng an toàn,Nối đàn hồi,Nối bản lề,public_test_fix
Tóm tắt các thành phần có thể chèn vào Slide và cách tùy chỉnh giao diện/hiệu ứng trình chiếu.,Chỉ chèn được văn bản,Chỉ chèn được hình ảnh và video,"Có thể chèn văn bản, hình ảnh, âm thanh, video nhưng không đổi nền","Có thể chèn văn bản, hình, video, âm thanh; thay đổi màu nền, Template; tạo hiệu ứng chữ, hình, chuyển Slide",public_test_fix
Mối hàn đối đầu vát chữ V đơn khác gì so với mối hàn đối đầu vuông?,"Có rãnh vát mép, dễ thâm nhập mối hàn hơn","Dễ thực hiện hơn, không cần vát mép",Chỉ dùng cho vật liệu nhôm,Không dùng để truyền lực,public_test_fix
"Để hỗ trợ TLS tự ký, giải pháp cần cung cấp những tính năng nào?",Cho phép tạo chứng thư điện tử tự ký (Self-signed) TLS,Cho phép chứng thư điện tử được CA tin cậy cấp,Bắt buộc tất cả chứng thư đều do CA quốc tế cấp,Chỉ cho phép chứng thư gán cho tài khoản root,public_test_fix
"Chức năng đăng nhập một lần (Single Sign-On) trong Cloud Service Hub mang lại lợi ích chính nào, và tính năng OCR (Nhận diện ký tự quang học) trong Cloud Service Hub hỗ trợ người dùng như thế nào?","Single Sign-On cho phép truy cập nhiều dịch vụ đám mây bằng một lần đăng nhập, và OCR giúp chuyển hình ảnh/tài liệu quét thành văn bản có thể tìm kiếm.","Single Sign-On giúp giảm dung lượng tệp tin, và OCR có chức năng tự động dịch văn bản sang nhiều ngôn ngữ.","Single Sign-On hỗ trợ tăng tốc độ in, và OCR giúp nén tệp PDF để tiết kiệm dung lượng.","Single Sign-On cho phép in trực tiếp từ điện thoại, và OCR hỗ trợ gửi tài liệu đến email của người dùng.",public_test_fix
"Nếu vẽ sai quy ước (ví dụ dùng nét đậm cho đường đáy răng), hậu quả có thể là gì?",Bản vẽ đẹp mắt hơn,Không ảnh hưởng gì,"Dễ gây hiểu nhầm khi chế tạo, lắp ráp",Tiết kiệm thời gian vẽ,public_test_fix
"Trong tài liệu Public_478, phương pháp thiết kế nào cho phép điều chỉnh tham số β để cân bằng độ gợn râu và độ dốc?",Window Hamming,Window Kaiser,Parks–McClellan,Butterworth,public_test_fix
Sơ đồ chuỗi giá trị (Value Stream Mapping - VSM) có mục đích chính là gì?,Xác định hoạt động tạo giá trị và không tạo giá trị để cải tiến,Chỉ đo lường thời gian sản xuất,Tính toán chi phí nguyên vật liệu,Lập kế hoạch marketing,public_test_fix
"Dựa vào Bảng 2.8, có tổng cộng bao nhiêu chuyên gia được khảo sát có thâm niên hoạt động từ 20 năm trở lên?",80,45,23,68,public_test_fix
"Theo Bảng 1, đường kính trong của họng lớn và họng nhỏ trên trụ nổi lần lượt là bao nhiêu?", 125 mm và 69 mm,110 mm và 69 mm,350 mm và 270 mm,110 mm và 125 mm,public_test_fix
"Theo yêu cầu vận hành, tình trạng kỹ thuật của trụ nước phải được kiểm tra với tần suất như thế nào?", Ít nhất một lần mỗi năm," Ít nhất hai lần trong năm, khoảng cách giữa hai lần không quá 6 tháng.",Sau mỗi lần được sử dụng để chữa cháy.,Chỉ khi có yêu cầu từ cơ quan có thẩm quyền,public_test_fix
"Theo bảng ""Các nhóm nhiệm vụ ưu tiên thực hiện"", thời gian thực hiện và tổng vốn đầu tư dự kiến cho nhiệm vụ ""Xây dựng Trung tâm điều hành thành phố thông minh"" lần lượt là bao nhiêu?","2019-2022 và 18,00 tỷ đồng","2019-2020 và 15,00 tỷ đồng","2019-2021 và 35,00 tỷ đồng","2020-2022 và 10,00 tỷ đồng",public_test_fix
Bảng trong Public 507 cung cấp những thông tin gì?,"Điện trở suất, hệ số nhiệt, nhiệt độ nóng chảy, ứng dụng",Chỉ có công suất truyền tải và độ bền cơ học,Độ cứng và khối lượng riêng,Độ dẫn nhiệt và hệ số giãn nở nhiệt,public_test_fix
"Nội dung chính của phần ""Thực nghiệm"" trong tài liệu Public_576 là gì?","Giới thiệu chi tiết về lý thuyết và công thức toán học của các thuật toán Hồi quy tuyến tính (LR), Random Forest (RF) và K-lân cận gần nhất (KNN)",Trình bày bảng tọa độ và độ cao chi tiết của 7 điểm hạng III và 74 điểm hạng IV được sử dụng làm dữ liệu đầu vào cho mô hình,"Sử dụng bộ dữ liệu đo cao GPS và thủy chuẩn để so sánh độ chính xác của ba thuật toán nội suy (KNN, LR, RF) thông qua các phương án thực nghiệm khác nhau",Phân tích ưu và nhược điểm của việc sử dụng phương pháp đo cao bằng GPS so với phương pháp đo thủy chuẩn truyền thống.,public_test_fix
"Trong bảo dưỡng thiết bị theo quý, kỹ thuật viên cần thực hiện những công việc nào?",Rà soát và xóa logfile cũ,Cập nhật thời gian hệ thống,Thay thế card SUP,Lắp đặt thiết bị mới,public_test_fix
Cloud Service Hub hỗ trợ chức năng quét với độ phân giải tối đa là bao nhiêu dpi?,200 dpi,300 dpi,400 dpi,600 dpi,public_test_fix
Cáp quang được cấu tạo từ vật liệu nào để truyền tín hiệu ánh sáng?,Kim loại và nhựa tổng hợp,Sợi thủy tinh hoặc plastic tinh chế,Dây đồng mạ kẽm,Nhôm và thép không gỉ,public_test_fix
Tổn thất áp lực dọc đường ở một đoạn ống dài $L$ (m) được nêu gần đúng bởi công thức nào?,"$\Delta P = \dfrac{A\,Q}{100}\,L$","$\Delta P = \dfrac{Q^{2}\,L}{100\,K_T}$","$\Delta P = \dfrac{A\,Q^{2}}{L}$","$\Delta P = K_T\,Q\,L$",public_test_fix
Điểm khác biệt quan trọng giữa sơ đồ chuỗi giá trị và sơ đồ quy trình chi tiết là gì?,VSM đi sâu vào từng thao tác nhỏ,VSM tập trung vào quản lý kho,VSM chỉ quan tâm đến dữ liệu tài chính,VSM tập trung vào dòng vật chất và thông tin thay vì chi tiết từng nhiệm vụ,public_test_fix
Tổng chi phí cơ bản cho dịch vụ kỹ thuật ở giai đoạn giám sát xây dựng (tính bằng JPY) là bao nhiêu?,"655,773,666 JPY","452,232,672 JPY","1,108,006,338 JPY","498,140,000 JPY",public_test_fix
"Vì sao trong quy trình lại phân chia thành nhiều tầng (Tier 1, Tier 2, Tier 3) thay vì chỉ có một bộ phận xử lý sự cố ATTT?","Vì phân tầng giúp chia nhỏ khối lượng công việc, đảm bảo sự cố được xử lý theo mức độ phức tạp và năng lực chuyên môn.","Vì chỉ Tier 1 có quyền quản lý ticket, còn các tầng khác chỉ hỗ trợ.","Vì SOC Manager chỉ muốn theo dõi, không trực tiếp xử lý sự cố","Vì việc phân tầng chỉ nhằm mục đích tăng tính hình thức, không ảnh hưởng đến hiệu quả xử lý.",public_test_fix
Công nghệ ảo hóa trong hệ thống được đề xuất sử dụng trong tài liệu Public_609 là gì?,Hyper-V,Vmware,Proxmox,XenServer,public_test_fix
"Để xác định sơ đồ dòng hiện trạng, doanh nghiệp cần thực hiện những bước nào và thu thập thông tin gì?","Khảo sát tổng thể nhà máy; thu thập thông tin về công việc, bộ phận, thời gian ca, lịch bảo trì",Chỉ hỏi lãnh đạo cấp cao; thu thập dữ liệu tài chính,Phỏng vấn khách hàng; ghi nhận doanh thu,Đo lường tự động; thu thập dữ liệu bán hàng,public_test_fix
"Theo kết quả khảo sát các chuyên gia trong tài liệu, đâu là những rào cản chính từ cả phía Cung và phía Cầu đối với việc phát triển thị trường thiết bị chuyển đổi năng lượng tái tạo tại vùng Trung du miền núi phía Bắc?", Phụ thuộc vào việc nhập khẩu thiết bị và thiếu các dịch vụ cung ứng đồng bộ trên thị trường,Tiềm năng năng lượng gió thấp và thiếu các chính sách đồng bộ của nhà nước về quy hoạch,Phía Cung gặp khó khăn do suất đầu tư cao và công nghệ phức tạp; Phía Cầu bị hạn chế bởi khả năng tài chính của người dân và niềm tin của người tiêu dùng,Người dân thiếu kiến thức vận hành thiết bị và chi phí vận hành sau khi đầu tư còn khá cao,public_test_fix
"Dựa vào Bảng 4.16, hãy tính tổng số lượng doanh nghiệp có tốc độ tăng trưởng doanh thu ở mức 'Ổn định' hoặc 'Tăng' trên cả hai nhóm áp dụng chiến lược (chủ động và phản ứng).",51,60,76,81,public_test_fix
Đồng thau và thiếc có đặc điểm và ứng dụng gì nổi bật?,"Đồng thau dùng cho lá tiếp xúc, thiếc dùng làm chất hàn","Đồng thau chịu được nhiệt cao, thiếc chủ yếu làm dây dẫn",Cả hai đều được dùng để chế tạo cầu chì,Cả hai đều có điện trở suất nhỏ hơn đồng đỏ,public_test_fix
Tiêu chuẩn TCXDVN 170:2007 áp dụng cho loại thép nào?,Thép các bon và thép hợp kim thấp có giới hạn chảy 225–435 N/mm²,Thép không gỉ có giới hạn chảy trên 500 N/mm²,Thép hợp kim đặc biệt dùng trong thiết bị nâng chuyển,Thép tấm cán nguội dùng cho đường sắt,public_test_fix
"Khi nào cần dùng mối ghép then hoa, và có những dạng răng nào thường gặp?",Khi truyền tải nhỏ; răng hình thang,Khi lắp tạm thời; răng cong,"Khi truyền mômen lớn; răng chữ nhật, thân khai, tam giác",Khi chỉ cần định vị; răng vát xiên,public_test_fix
Tại sao khi lắp ráp nên chia nhỏ thành các cụm lắp con?,Giúp dễ quản lý và tiết kiệm thời gian xử lý,Giảm số chi tiết cơ khí,Đảm bảo độ chính xác tuyệt đối,Tránh cần ràng buộc,public_test_fix
"Khi vẽ sơ đồ chuỗi giá trị, cần xác định những dòng thông tin nào từ khách hàng và nhà cung ứng?","Thông tin đơn hàng, số lượng, cam kết giao hàng; nhu cầu vật tư và khả năng đáp ứng",Thông tin marketing và giá bán,Chỉ thông tin kho thành phẩm,Chỉ số nhân công và chi phí vận hành,public_test_fix
"Dựa vào tài liệu Public_586, chi phí xây dựng đập chắn bằng tường bê tông cao hơn bao nhiêu so với phương án xây bằng đá hộc có độ dốc?","5,5 triệu USD","14,0 triệu USD","8,5 triệu USD","19,5 triệu USD",public_test_fix
"Trong tài liệu Public_632, có tổng cộng bao nhiêu loại thiết bị được mô tả chi tiết kèm yêu cầu kỹ thuật?",2,3,4,5,public_test_fix
"Nếu trên bản vẽ không ghi rõ chiều dài đoạn hàn trong mối hàn ngắt quãng, hậu quả là gì?",Không ảnh hưởng,Người gia công khó xác định và có thể hàn sai quy cách,Mối hàn luôn bền hơn,Tự động lấy chiều dài chuẩn,public_test_fix
"Theo Bảng 3.9 tài liệu Public_595, hàm lượng rượu và đường sót ở môi trường lên men có pH ban đầu là 4 lần lượt là bao nhiêu?","11,03% V/V và 5,57 g/l","10,08% V/V và 5,03 g/l","11,16% V/V và 4,48 g/l","11,01% V/V và 4,64 g/l",public_test_fix
"Theo Bảng 3.1, chỉ số độ sạch (A260/A280) của mẫu RNA C4.1 là bao nhiêu?","1,96"," 
2,08"," 
2,11"," 
1,90",public_test_fix
Nội dung chính của Giai đoạn I trong Kế hoạch triển khai dự án cấp nước tỉnh Bình Dương là gì?,Chỉ bao gồm xây dựng công trình và dịch vụ kỹ thuật.,Chỉ bao gồm phần chuẩn bị của chủ dự án và thu hồi đất.,"Bao gồm Xây dựng công trình, Dịch vụ Kỹ thuật, và Phần chuẩn bị của chủ dự án.","Bao gồm Vận hành, bảo dưỡng và giám sát xây dựng.",public_test_fix
"Dựa vào Bảng 3.1, hãy tính năng lượng liên kết trung bình của dẫn xuất VK3-1 trên cả 6 mục tiêu gắn kết được liệt kê.",-7.26 kcal.mol-1,-6.33 kcal.mol-1,-5.88 kcal.mol-1,-6.58 kcal.mol-1,public_test_fix
"Theo tài liệu, đơn vị nào chủ trì nhiệm vụ ""Xây dựng Trung tâm điều hành thành phố thông minh""?", Văn phòng Ủy ban nhân dân tỉnh,Sở Giáo dục và Đào tạo,Sở Thông tin và Truyền thông,Các doanh nghiệp viễn thông ,public_test_fix
"Hình dạng 'chuông' của biểu đồ phân bố phản ánh điều gì, và ý nghĩa quản lý là gì?","Quá trình ổn định, phân bố chuẩn",Dữ liệu bị pha trộn,Có giá trị bất thường,Độ rộng nhóm không phù hợp,public_test_fix
"Theo điều kiện số lượng đầu phun tối thiểu $n \ge \dfrac{S}{\Omega}$ với $\Omega = L^2$. Nếu diện tích cần bảo vệ $S=180\,\mathrm{m^2}$ và khoảng cách giữa các đầu phun $L=3\,\mathrm{m}$, hãy chọn $n$ nhỏ nhất thỏa mãn.",20,18,22,15,public_test_fix
"chỉ tiêu cấp điện cho trường học phổ thông có điều hòa nhiệt độ là bao nhiêu, và chỉ tiêu cho nhà trẻ/mẫu giáo không có điều hòa là bao nhiêu?","0,1 kW/HS và 0,15 kW/cháu","0,15 kW/HS và 0,2 kW/cháu","0,2 kW/HS và 0,1 kW/cháu","0,25 kW/HS và 0,3 kW/cháu",public_test_fix
"Trong chức năng Website, người dùng có thể thực hiện những thao tác nào sau đây",Đổi mật khẩu tài khoản đăng nhập website,Xem lịch sử IP đăng nhập tài khoản,Nhân bản website,Quản lý phiếu chi,public_test_fix
"Nếu biểu đồ phân bố có dạng 2 đỉnh, điều này cho thấy gì và cần làm gì?",Quá trình rất ổn định,Dữ liệu bị cắt cụt,Do công cụ đo sai,Hai phân bố khác nhau bị trộn lẫn,public_test_fix
Nguồn pin 9V của đầu báo WSD-1 có thể sử dụng liên tục tối đa bao lâu?,36 tháng,24 tháng,12 tháng,48 tháng,public_test_fix
"Trong tiêu chí an toàn thông tin cho hạ tầng điện toán đám mây, có bao nhiêu tính năng cơ bản được liệt kê trong phần “Yêu cầu cơ bản về tính năng an toàn thông tin”?",10,12,14,15,public_test_fix
"Dựa vào Bảng 1, chiều cao của trụ nổi chênh lệch so với trụ ngầm là bao nhiêu?",530 mm,970 mm,1500 mm,2470 mm,public_test_fix
Bộ truyền xích khác bộ truyền đai ở điểm nào?,Đều dùng ma sát để truyền động,Đai và xích đều không ăn khớp,"Xích dễ trượt, đai không trượt","Xích truyền động bằng ăn khớp, đai truyền động bằng ma sát",public_test_fix
Có bao nhiêu chức năng trong hệ thống WEB2S_V23.10,5 chức năng,6 chức năng,7 chức năng,8 chức năng,public_test_fix
"Nếu tham số insecure trong cấu hình dịch vụ (ví dụ: keystone_authtoken) được đặt giá trị True, điều đó có thể dẫn đến rủi ro gì?",Hệ thống vẫn đảm bảo an toàn tuyệt đối,"Các kết nối TLS có thể bị bỏ qua, làm giảm tính bảo mật",Máy ảo sẽ không thể tách biệt logic,Người dùng không thể thay đổi mật khẩu,public_test_fix
Tại sao không nên chia nhỏ hoạt động thành nhiều nhiệm vụ nhỏ khi vẽ sơ đồ chuỗi giá trị?,Vì sẽ giúp biểu đồ dễ đọc,Vì sẽ làm biểu đồ phức tạp và không đạt mục đích mô tả dòng chảy,Vì dễ bỏ sót công việc,Vì giảm số công đoạn hiển thị,public_test_fix
"Ràng buộc Mate định nghĩa mối quan hệ nào giữa hai bề mặt, và trong trường hợp nào nên dùng Flush thay vì Mate?",Mate: làm cho hai bề mặt/đường tiếp xúc (đối diện hoặc chồng lên nhau); dùng Flush khi cần hai bề mặt song song hoặc cùng hướng.,Mate: tạo khoảng cách cố định giữa hai trục; Flush: dùng để tạo tâm lỗ.,Mate: áp dụng cho ren và rãnh; Flush: áp dụng cho lỗ tròn.,Mate: ràng buộc tiếp tuyến giữa hai đường cong; Flush: giữ khoảng cách không đổi giữa hai mặt.,public_test_fix
Vì sao ký hiệu hóa mối hàn lại quan trọng trong thiết kế cơ khí?,"Giúp tiêu chuẩn hóa, truyền đạt rõ ràng yêu cầu kỹ thuật, tránh sai sót khi chế tạo",Giúp bản vẽ đẹp hơn,Giảm số ký hiệu trên bản vẽ,Thay thế cho kiểm tra chất lượng,public_test_fix
Mỗi tổ hợp không dây FSMBL-001 quản lý tối đa bao nhiêu đầu báo khói WSD-1?,10,30,50,300,public_test_fix
"Trong quy ước vẽ then hoa, nét liền đậm và nét liền mảnh dùng để thể hiện gì?",Liền đậm: đường tâm; Liền mảnh: đường đối xứng,Liền đậm: đường kích thước; Liền mảnh: đường ghi chú,Liền đậm: đường mặt đáy; Liền mảnh: đường chân ren,Liền đậm: mặt đỉnh răng; Liền mảnh: mặt đáy răng và đường tròn cơ bản,public_test_fix
Linh kiện nào có chức năng hạn chế dòng điện chạy qua mạch?,Điện trở,Tụ điện,Transistor,Diode,public_test_fix
Công cụ nào được dùng để chèn một chi tiết có sẵn vào môi trường lắp ráp?,Assemble → Create,Assemble → Place,Assemble → Pattern,Assemble → Mirror,public_test_fix
"Dựa vào bảng ""Các nhóm nhiệm vụ ưu tiên thực hiện"", tổng nguồn vốn từ ""Doanh nghiệp, Xã hội hóa"" cho các nhiệm vụ thuộc nhóm ""Giáo dục thông minh"" được liệt kê trong tài liệu là bao nhiêu?","14,00 tỷ đồng","5,00 tỷ đồng","20,50 tỷ đồng","30,10 tỷ đồng",public_test_fix
"Nếu muốn trình chiếu lặp lại liên tục từ đầu đến khi nhấn Esc, bạn cần chọn tùy chọn nào trong hộp thoại “Setup Slide Show”?",Show without animation,Loop continuously until 'Esc',"Using timings, if present",Browsed by an individual (window),public_test_fix
Tóm tắt các loại linh kiện điện tử phổ biến và vai trò của chúng trong cuộc sống.,"Điện trở, tụ điện, cuộn cảm, transistor, diode, IC… giúp kiểm soát dòng điện và duy trì hoạt động của thiết bị điện tử",Chỉ gồm linh kiện thụ động,Chỉ gồm linh kiện chủ động,Chỉ gồm linh kiện cơ điện,public_test_fix
Doanh nghiệp nên dùng công cụ nào khác khi muốn phân tích chi tiết để tối ưu hóa từng công đoạn thay vì chỉ mô tả dòng chảy tổng thể?,VSM,Sơ đồ tổ chức,"Các công cụ cải tiến chuyên sâu khác (ví dụ Kaizen, Six Sigma)",Biểu đồ cột,public_test_fix
"Nếu một mạch điện cần chỉnh lưu dòng AC thành DC, linh kiện nào được lựa chọn?",Điện trở,Diode,Tụ điện,Transistor,public_test_fix
"Trong khu vực bảo vệ nguồn nước, bán kính bảo vệ tối thiểu của giếng khoan nước ngầm là bao nhiêu mét, và nội dung nào bị cấm trong khu vực này?","25m; cấm xây dựng, đào hố phân, đổ rác, chăn nuôi","100m; cấm xây dựng, chăn nuôi, trồng cây ăn quả","200m; cấm xây dựng, tắm giặt, xả nước thải","300m; cấm xây dựng, trồng rau màu, khai thác cát",public_test_fix
"Trong quy trình xử lý sự cố an toàn thông tin, nhiệm vụ chính của Tier 1 là gì, và công cụ nào được sử dụng để quản lý ticket sự cố?","Tier 1 tiếp nhận, xác minh cảnh báo ban đầu; công cụ sử dụng là SOAR.",Tier 1 trực tiếp khắc phục sự cố nghiêm trọng; công cụ sử dụng là SIEM.,Tier 1 chỉ tham gia khi Tier 2 yêu cầu hỗ trợ; công cụ sử dụng là Email nội bộ.,Tier 1 quản lý kế hoạch ứng cứu tổng thể; công cụ sử dụng là Excel.,public_test_fix
"Trong 5 giai đoạn của VSM, giai đoạn nào liên quan đến việc xây dựng sơ đồ hiện tại và giai đoạn nào tập trung vào nhận diện cơ hội cải tiến?",Giai đoạn I và V,Giai đoạn I và II,Giai đoạn II và III,Giai đoạn III và IV,public_test_fix
"Trong tiêu chuẩn về bảo hành và việc đáp ứng bảo hành theo yêu cầu, nhà thầu được đánh giá là Đạt khi đáp ứng những điều kiện nào dưới đây?","Thời gian bảo hành ≥ 12 tháng, riêng hệ thống đèn Led ≥ 5 năm, có thuyết minh phương án bảo hành phù hợp","Thời gian bảo hành < 12 tháng, hệ thống đèn Led ≤ 5 năm.",Thời gian thực hiện công tác bảo hành trong vòng 24 giờ sau khi nhận thông báo.,Thời gian thực hiện công tác bảo hành chậm hơn 48 giờ sau khi nhận thông báo.,public_test_fix
"Nếu khách hàng cần một chiếc xe nhỏ gọn, tiết kiệm nhiên liệu (4.8L/100km ngoài đô thị) và nhiều công nghệ an toàn, Toyota Raize có phù hợp không?","Có, vì xe tiết kiệm xăng, trang bị an toàn đầy đủ, tiện nghi phong phú","Không, vì xe chỉ hợp chạy đô thị","Không, vì xe không tiết kiệm nhiên liệu","Có, vì kiểu dáng đẹp",public_test_fix
"Trong Lean, 'lãng phí' được định nghĩa là gì?",Hoạt động tiêu tốn nhiều nguyên liệu,Hoạt động tiêu tốn nhiều nhân công,Hoạt động không làm tăng giá trị cho sản phẩm,Hoạt động làm giảm năng suất lao động,public_test_fix
"Theo Bảng 2.1, tổng công suất lắp đặt của 10 nhà máy thủy điện công suất lớn (từ 100 MW trở lên) tại vùng Trung du miền núi phía Bắc (TDMNPB) là bao nhiêu?",14.310 MW,4.569 MW,7.172 MW,2.344 MW,public_test_fix
Diode có chức năng gì và thường được sử dụng trong ứng dụng nào?,"Cho dòng đi một chiều, tạo ánh sáng","Chỉnh lưu dòng AC, khuếch đại tín hiệu","Cho dòng đi một chiều, chỉnh lưu AC thành DC","Lưu trữ năng lượng, phát hiện tín hiệu",public_test_fix
"Khi ghi ký hiệu mối hàn, tại sao không cần vẽ chi tiết từng lớp vật liệu đắp?",Vì bản vẽ hàn không yêu cầu kỹ thuật,Vì không quan trọng,Vì ký hiệu tiêu chuẩn đã đủ để thể hiện thông tin cần thiết,Vì thợ hàn sẽ tự chọn,public_test_fix
Hãy tóm tắt các nhóm linh kiện điện tử quan trọng và vai trò của chúng trong nghề sửa chữa điện tử.,"Chỉ có điện trở, tụ điện và diode",Chủ yếu là transistor và IC,"Gồm điện trở, tụ điện, cuộn cảm, diode, transistor, IC, triac/thyristor, biến trở, LED và cảm biến; chúng có chức năng từ lưu trữ, điều khiển, khuếch đại đến phát sáng và chuyển đổi tín hiệu",Chủ yếu là cảm biến và LED,public_test_fix
"Để kiểm tra số bậc tự do còn lại của chi tiết trong lắp ráp, ta dùng công cụ nào?",Inspect,Constraint,Degree of Symmetry,Degrees of Freedom Indicator,public_test_fix
Đâu là tóm tắt đúng nhất về các điều kiện tối ưu cho quá trình lên men vang dứa Queen bằng chủng S. cerevisiae D8?,"pH=3, đường 200 g/l, oxy 5 mg/l, men giống 2%, nhiệt độ 24°C","pH=4, đường 220 g/l, oxy 7 mg/l, men giống 5%, nhiệt độ 28°C","pH=5, đường 250 g/l, oxy 9 mg/l, men giống 10%, nhiệt độ 32°C","pH=3.5, đường 170 g/l, oxy 6 mg/l, men giống 7%, nhiệt độ 36°C",public_test_fix
"Trong hình chiếu vuông góc trục, tại sao không cần vẽ phần vát đầu răng và khe hở của then hoa?",Vì theo quy ước để đơn giản hóa bản vẽ mà vẫn đảm bảo ý nghĩa kỹ thuật,Vì không có tác dụng cơ khí,Vì không thể hiện được trên giấy,Vì tiêu chuẩn cấm vẽ,public_test_fix
"Nếu một bóng đèn LED tiêu thụ công suất 10W, hoạt động liên tục trong 5 giờ, thì lượng điện năng tiêu thụ là bao nhiêu Wh?",10,25,40,50,public_test_fix
Tần suất bảo dưỡng thiết bị mạng theo tháng được quy định là bao nhiêu?,1 lần/tuần,1 lần/tháng,1 lần/3 tháng,2 lần/tháng,public_test_fix
